{
  "card_type": "validation",
  "validation_id": "val_probe_001",
  "target_type": "hypothesis",
  "target_id": "hyp_probe_001",
  "validation_method": "event_study",
  "result": "mixed",
  "metrics": {
    "sample_count": 12,
    "win_rate": 0.58,
    "avg_excess_return_20d": 0.034,
    "avg_excess_return_60d": 0.051
  },
  "sample_count": 12,
  "failure_reasons": [
    "樣本事件定義偏寬",
    "部分公司與主題連動度不足",
    "短線受大盤風險偏好干擾"
  ],
  "conclusion": "探針題材具有中度有效性，但需要更精準限定事件定義與公司範圍。",
  "follow_up_actions": [
    "縮小公司池到直接受益者",
    "加入外資期貨部位作為控制變數",
    "再區分20日與60日視窗"
  ],
  "created_at": "2026-04-20T18:00:00+08:00"
}
